{
    "slug": "easybell",
    "categories": [
        "telecommunication"
    ],
    "name": "easybell GmbH",
    "address": "Datenschutzbeauftragter\nMagazinstraße 15 – 16\n10179 Berlin\nDeutschland",
    "phone": "+49 30 80 95 1081",
    "fax": "+49 30 80 95 1009",
    "email": "datenschutz@easybell.de",
    "web": "https://www.easybell.de/",
    "sources": [
        "https://www.easybell.de/datenschutz.html",
        "https://www.easybell.de/impressum.html"
    ]
}