{
    "slug": "jako-o",
    "categories": [
        "Handel"
    ],
    "name": "Jako-o Möbel und Spielmittel für die junge Familie GmbH",
    "runs": [
        "Mein JAKO-O"
    ],
    "address": "Datenschutz\n96475 Bad Rodach\nDeutschland",
    "phone": "+49 9564 929 11 12",
    "fax": "+49 9564 929 662 500",
    "email": "service@jako-o.de",
    "web": "https://www.jako-o.de/",
    "sources": [
        "https://www.jako-o.de/--00003009/",
        "https://www.jako-o.de/--00003011/"
    ]
}