{
    "slug": "vr-bank",
    "categories": [
        "Bank"
    ],
    "name": "Bundesverband der Deutschen Volksbanken und Raiffeisenbanken e.V. (BVR)",
    "address": "Datenschutzbeauftragter\nSchellingstra√üe 4\n10785 Berlin\nDeutschland",
    "phone": "+49 30 2021 0",
    "fax": "+49 30 2021 1900",
    "email": "info@bvr.de",
    "web": "https://www.vr.de/privatkunden.html",
    "sources": [
        "https://www.vr.de/privatkunden/service/datenschutz.html",
        "https://www.vr.de/privatkunden/service/impressum.html"
    ]
}