{
    "slug": "acxiom",
    "categories": [
        "Adressen"
    ],
    "name": "Acxiom Deutschland GmbH",
    "address": "Martin-Behaim Stra√üe 12\n63263 Neu-Isenburg\nDeutschland",
    "phone": "+49 6102 736 3",
    "fax": "+49 6102 736 444",
    "email": "datenschutz@acxiom.com",
    "web": "http://www.acxiom.de/",
    "sources": [
        "http://www.acxiom.de/datenschutz/",
        "http://www.acxiom.de/impressum/",
        "https://marketing.acxiom.com/AcxiomDE-Verbraucheranfragen.html"
    ],
    "required-elements-access": [
        {
            "desc": "Name",
            "type": "input"
        },
        {
            "desc": "Geburtsdatum",
            "type": "input"
        },
        {
            "desc": "Adresse",
            "type": "address"
        }
    ]
}