{
    "slug": "tnt",
    "categories": [
        "commerce"
    ],
    "name": "TNT Express GmbH",
    "runs": [
        "TNT Paketdienst",
        "TNT Express"
    ],
    "address": "Datenschutzbeauftragter\nHaberstra√üe 2\n53842 Troisdorf\nDeutschland",
    "phone": "+49 22 41 497 0",
    "fax": "+49 22 41 497 66 65",
    "email": "datenschutz@tnt.de",
    "web": "https://www.tnt.com/express/de_de/site/home.html",
    "sources": [
        "https://www.tnt.com/express/de_de/site/home/terms-conditions.html",
        "https://www.tnt.com/express/de_de/site/home/Impressum.html"
    ]
}