{
    "slug": "home24",
    "categories": [
        "Handel"
    ],
    "name": "Home24 AG",
    "runs": [
        "Smood (www.smood-sleep.de)",
        "Black Friday Möbel (www.black-friday-moebel.de)"
    ],
    "address": "Greifswalder Straße 212 – 213\n10405 Berlin\nDeutschland",
    "phone": "+49 30 20 38 99 66",
    "fax": "+49 30 60 98 80 06 3",
    "email": "datenschutz@home24.de",
    "web": "https://www.home24.de/",
    "sources": [
        "https://www.home24.de/datenschutz/",
        "https://www.home24.de/impressum/"
    ]
}