{
    "slug": "riskident",
    "categories": [
        "Auskunftei"
    ],
    "name": "Risk.Ident GmbH",
    "address": "Am Sandtorkai 50\n20457 Hamburg\nDeutschland",
    "phone": "+49 40 60945 2590",
    "email": "contact@riskident.com",
    "web": "https://riskident.com",
    "comments": [
        "Externer Datenschutzbeauftragter: Christian Mommers, intersoft consulting services AG, Frankenstra√üe 18a, 20097 Hamburg, Deutschland.\nTelefon: +49 40 7902350, E-Mail: cmommers@intersoft-consulting.de"
    ]
}