{
    "slug": "deurema-inkasso",
    "categories": [
        "Inkasso"
    ],
    "name": "DEUREMA Deutsche Rechnungsmanagement GmbH",
    "address": "Ludwig-Erhard-Stra√üe 4\n84034 Landshut\nDeutschland ",
    "phone": "+49 871 92318 10",
    "fax": "+49 871 92318 90",
    "email": "email@deurema.de",
    "web": "https://www.deurema.de",
    "sources": [
        "https://www.deurema.de/impressum-dl-infov.html"
    ]
}