{
    "slug": "riek-adressen",
    "categories": [
        "addresses"
    ],
    "name": "Riek, direkt Marketing",
    "address": "Inh. Udo Riek\nHinter den HÃ¶fen 75\n31542 Bad Nenndorf\nDeutschland",
    "phone": "+49 57 23 79 30 68 4",
    "fax": "+49 163 56 07 57 6",
    "email": "info@riek-direkt.de",
    "web": "http://www.adressen-riek.de",
    "sources": [
        "http://www.adressen-riek.de/datenschutz/"
    ]
}