{
    "slug": "check24",
    "categories": [
        "ads",
        "insurance",
        "finance",
        "commerce",
        "telecommunication"
    ],
    "name": "CHECK24 Vergleichsportal GmbH",
    "runs": [
        "CHECK24 App",
        "CHECK24 Media GmbH",
        "CHECK24 Vergleichsportal für Versicherungsprodukte GmbH",
        "CHECK24 Versicherungsservice GmbH",
        "CHECK24 Vergleichsportal Finanzen GmbH",
        "CHECK24 Vergleichsportal Energie GmbH",
        "CHECK24 Vergleichsportal Telekommunikationsdienste GmbH",
        "CHECK24 Vergleichsportal Mobilfunk GmbH",
        "CHECK24 Vergleichsportal Mietwagen GmbH",
        "CHECK24 Vergleichsportal Reise GmbH",
        "CHECK24 Vergleichsportal Hotel GmbH",
        "CHECK24 Vergleichsportal Shopping GmbH",
        "CHECK24 Vergleichsportal Karten & Konten GmbH",
        "CHECK24 Services GmbH",
        "CHECK24 Vergleichsportal Autoteile GmbH",
        "CHECK24 Comparon GmbH",
        "CHECK24 Finanzservice GmbH",
        "TARIF CHECK24 GmbH",
        "CHECK24 Vergleichsportal Baufinanzierung GmbH"
    ],
    "address": "Erika-Mann-Str. 62 – 66\n80636 München\nDeutschland",
    "phone": "+49 89 200 047 1010",
    "fax": "+49 89 200 047 1011",
    "email": "webseite_datenschutz@check24.de",
    "web": "https://www.check24.de/",
    "sources": [
        "https://www.check24.de/popup/datenschutz/",
        "https://www.check24.de/unternehmen/impressum/"
    ]
}