{
    "slug": "branchenflat",
    "categories": [
        "Adressen"
    ],
    "name": "B2B Adressenmarketing GmbH",
    "address": "Datenschutzbeauftragter Herr Michael Merten\nIm Hollerfeld 12\n35325 MÃ¼cke\nDeutschland",
    "phone": "+49 180 15 0000 5",
    "fax": "+49 6401 9647238",
    "email": "ahlem.meddeb@b2badressenmarketing.de",
    "web": "http://branchenflat.de",
    "sources": [
        "http://branchenflat.de/de/datenschutz.html",
        "http://branchenflat.de/de/impressum.html"
    ]
}